{
  "id": "crew-12",
  "name": {
    "value": "Crew-12",
    "source": "https://www.nasa.gov/missions/station/what-you-need-to-know-about-nasas-spacex-crew-12-mission/",
    "as_of": "2026-10-03"
  },
  "vehicle": {
    "value": "クルードラゴン宇宙船「Freedom」",
    "source": "https://www.nasa.gov/missions/station/what-you-need-to-know-about-nasas-spacex-crew-12-mission/",
    "as_of": "2026-10-03",
    "note": "宇宙船の名前は NASA、種類の書き方は JAXA"
  },
  "destination": "iss",
  "launch_date": {
    "value": "2026-02-13",
    "source": "https://www.nasa.gov/blogs/spacestation/2026/02/13/nasas-spacex-crew-12-launches/",
    "as_of": "2026-10-03",
    "note": "打ち上げ済み。米国東部時間 5:15"
  },
  "return_date": {
    "value": "2026-10-08",
    "source": "https://www.nasa.gov/blogs/spacestation/2026/10/08/nasas-spacex-crew-12-dragon-splashes-down-at-1134-a-m-edt/",
    "as_of": "2026-10-08",
    "note": "帰還済み。米国東部夏時間 11:34、カリフォルニア州ロサンゼルス沖に着水（NASA）"
  },
  "crew": [
    {
      "astronaut": "jessica-meir",
      "role": {
        "value": "コマンダー",
        "source": "https://humans-in-space.jaxa.jp/iss/crew/",
        "as_of": "2026-10-03"
      }
    },
    {
      "astronaut": "jack-hathaway",
      "role": {
        "value": "パイロット",
        "source": "https://humans-in-space.jaxa.jp/iss/crew/",
        "as_of": "2026-10-03"
      }
    },
    {
      "astronaut": "sophie-adenot",
      "role": {
        "value": "ミッションスペシャリスト",
        "source": "https://humans-in-space.jaxa.jp/iss/crew/",
        "as_of": "2026-10-03"
      }
    },
    {
      "astronaut": "andrey-fedyaev",
      "role": {
        "value": "ミッションスペシャリスト",
        "source": "https://humans-in-space.jaxa.jp/iss/crew/",
        "as_of": "2026-10-03"
      }
    }
  ],
  "official_links": [
    {
      "label": "NASA Crew-12 の紹介",
      "url": "https://www.nasa.gov/missions/station/what-you-need-to-know-about-nasas-spacex-crew-12-mission/"
    },
    {
      "label": "JAXA ISS滞在クルー",
      "url": "https://humans-in-space.jaxa.jp/iss/crew/"
    }
  ],
  "updated_at": "2026-10-08"
}
